{
  "schema_version": 1,
  "campaign_id": "k4-d4-three-seed-c75cbfffc-h100",
  "recorded_at": "2026-09-01T15:35:00+00:00",
  "record_type": "synthetic_kclass_campaign",
  "run_root": "/scratch/gpfs/CRYOEM/gilleslab/em_work/codex/k4_symmetry_multiseed_c75cbfffc_20260901",
  "subject": {
    "kind": "synthetic",
    "molecular_family": "Ribosembly 50S assembly intermediates",
    "k": 4,
    "iterations": 5,
    "symmetry": "D4",
    "trajectory_scope": "Three independent D4 seeds; every numbered RECOVAR half-map average and RELION Class3D full map at iterations 1-5, plus last-numbered final class maps."
  },
  "source": {
    "recovar": {
      "commit": "c75cbfffc930e4dac7bcc2785f9220ad8472a5a5",
      "tree": "598f6cad6a17f3980bdded0d25524564b597c944",
      "checkout": "/scratch/gpfs/CRYOEM/gilleslab/mg6942/em_dev/recovar_pr158_k4_symmetry_multiseed_gate_c75cbfffc_20260901",
      "clean": true
    },
    "relion": {
      "commit": "d476e6f6a4f1f37627c06ace5227fc374c0c2b05",
      "tree": "1633d228e89d91ede8ad0996e727ec6ab1bc96ee",
      "checkout": "/scratch/gpfs/CRYOEM/gilleslab/mg6942/em_dev/relion_k4_100k_dispatchv2_20260717/source",
      "source_diff_sha256": "6987c5ce397cbdd98835682cf1481a150c38c48cda621e006341d01a77e11c11",
      "executable": {
        "path": "/scratch/gpfs/CRYOEM/gilleslab/mg6942/em_dev/relion_k4_100k_dispatchv2_20260717/build/bin/relion_refine_mpi",
        "sha256": "01fa9cc870fdce6c19d981d6e917765753406972abcddb0311a40ef88e69a782",
        "size_bytes": 11106320
      }
    },
    "custom_cuda": {
      "path": "/scratch/gpfs/CRYOEM/gilleslab/em_work/codex/k4_symmetry_multiseed_c75cbfffc_20260901/cuda/shared/libcuda_backproject.so",
      "sha256": "266267fb9acfcf9994ec18ba22f74467b3e05369b96252ab936d885c819d98b2",
      "size_bytes": 47142296
    }
  },
  "reproduction": {
    "setup_command": "sbatch /scratch/gpfs/CRYOEM/gilleslab/em_work/codex/k4_symmetry_multiseed_c75cbfffc_20260901/jobs/em_kclass_matrix_setup.sh",
    "case_command_template": "sbatch /scratch/gpfs/CRYOEM/gilleslab/em_work/codex/k4_symmetry_multiseed_c75cbfffc_20260901/jobs/em_kclass_matrix_32_ribo_k4_5k_g128_white_noise1_d4_uniform_seed<SEED>.sh",
    "summary_command": "sbatch /scratch/gpfs/CRYOEM/gilleslab/em_work/codex/k4_symmetry_multiseed_c75cbfffc_20260901/jobs/em_kclass_matrix_summary.sh",
    "trajectory_audit_command": "sbatch --parsable --account=gilles --partition=cpu --nodes=1 --ntasks=1 --cpus-per-task=2 --mem=16G --time=02:00:00 --output=<CASE_ROOT>/trajectory_analysis/audit_slurm-%j.out --error=<CASE_ROOT>/trajectory_analysis/audit_slurm-%j.err --wrap=\"unset PYTHONPATH PYTHONHOME CONDA_PREFIX VIRTUAL_ENV; export PYTHONNOUSERSITE=1 XLA_PYTHON_CLIENT_PREALLOCATE=false; cd /scratch/gpfs/CRYOEM/gilleslab/mg6942/em_dev/recovar_pr158_k4_symmetry_multiseed_gate_c75cbfffc_20260901; /scratch/gpfs/CRYOEM/gilleslab/em_work/codex/k4_symmetry_multiseed_c75cbfffc_20260901/venv/bin/python scripts/audit_k4_fsc_trajectory.py --case-root <CASE_ROOT>\"",
    "environment": {
      "set": {
        "PYTHONNOUSERSITE": "1",
        "XLA_PYTHON_CLIENT_PREALLOCATE": "false",
        "PIXI_FROZEN": "true",
        "RECOVAR_EXPECTED_REPO_ROOT": "/scratch/gpfs/CRYOEM/gilleslab/mg6942/em_dev/recovar_pr158_k4_symmetry_multiseed_gate_c75cbfffc_20260901",
        "RECOVAR_CUDA_LIB": "/scratch/gpfs/CRYOEM/gilleslab/em_work/codex/k4_symmetry_multiseed_c75cbfffc_20260901/cuda/shared/libcuda_backproject.so",
        "RECOVAR_RELION_BIND_BUILD_DIR": "/scratch/gpfs/CRYOEM/gilleslab/em_work/codex/k4_symmetry_multiseed_c75cbfffc_20260901/relion_bind_build/shared",
        "RELION_SRC_DIR": "/scratch/gpfs/CRYOEM/gilleslab/mg6942/em_dev/relion_k4_100k_dispatchv2_20260717/source/src",
        "EM_KCLASS_MATRIX_THREE_SEED_VALUES": "41001,41002,41003"
      },
      "confirmed_unset": [
        "PYTHONPATH",
        "PYTHONHOME",
        "CONDA_PREFIX",
        "VIRTUAL_ENV",
        "TF_GPU_ALLOCATOR",
        "RECOVAR_FINAL_ALL_DATA_GRID_CORRECT",
        "RECOVAR_FINAL_ALL_DATA_AFTER_MAX_ITER"
      ]
    }
  },
  "shared_jobs": [
    {
      "role": "environment_setup",
      "job_id": "13301401",
      "status": "COMPLETED",
      "exit_code": "0:0",
      "elapsed_s": 61,
      "node": "della-r3c4n15",
      "gpu_model": null,
      "gpu_uuid": null,
      "req_tres": "billing=16,cpu=8,mem=64G,node=1",
      "alloc_tres": "billing=16,cpu=8,mem=64G,node=1",
      "max_rss_kib": 3006748,
      "logs": [
        "/scratch/gpfs/CRYOEM/gilleslab/em_work/codex/k4_symmetry_multiseed_c75cbfffc_20260901/em_kclass_matrix_setup.out",
        "/scratch/gpfs/CRYOEM/gilleslab/em_work/codex/k4_symmetry_multiseed_c75cbfffc_20260901/em_kclass_matrix_setup.err"
      ]
    },
    {
      "role": "d4_seed_41001_trajectory_audit",
      "job_id": "13303685",
      "status": "COMPLETED",
      "exit_code": "0:0",
      "elapsed_s": 171,
      "node": "della-r3c2n2",
      "gpu_model": null,
      "gpu_uuid": null,
      "req_tres": "billing=4,cpu=2,mem=16G,node=1",
      "alloc_tres": "billing=4,cpu=2,mem=16G,node=1",
      "max_rss_kib": null,
      "logs": [
        "/scratch/gpfs/CRYOEM/gilleslab/em_work/codex/k4_symmetry_multiseed_c75cbfffc_20260901/cases/32_ribo_k4_5k_g128_white_noise1_d4_uniform_seed41001/trajectory_analysis/audit_slurm-13303685.out",
        "/scratch/gpfs/CRYOEM/gilleslab/em_work/codex/k4_symmetry_multiseed_c75cbfffc_20260901/cases/32_ribo_k4_5k_g128_white_noise1_d4_uniform_seed41001/trajectory_analysis/audit_slurm-13303685.err"
      ]
    },
    {
      "role": "d4_seed_41002_trajectory_audit",
      "job_id": "13303686",
      "status": "COMPLETED",
      "exit_code": "0:0",
      "elapsed_s": 191,
      "node": "della-r3c2n8",
      "gpu_model": null,
      "gpu_uuid": null,
      "req_tres": "billing=4,cpu=2,mem=16G,node=1",
      "alloc_tres": "billing=4,cpu=2,mem=16G,node=1",
      "max_rss_kib": null,
      "logs": [
        "/scratch/gpfs/CRYOEM/gilleslab/em_work/codex/k4_symmetry_multiseed_c75cbfffc_20260901/cases/32_ribo_k4_5k_g128_white_noise1_d4_uniform_seed41002/trajectory_analysis/audit_slurm-13303686.out",
        "/scratch/gpfs/CRYOEM/gilleslab/em_work/codex/k4_symmetry_multiseed_c75cbfffc_20260901/cases/32_ribo_k4_5k_g128_white_noise1_d4_uniform_seed41002/trajectory_analysis/audit_slurm-13303686.err"
      ]
    },
    {
      "role": "d4_seed_41003_trajectory_audit",
      "job_id": "13303687",
      "status": "COMPLETED",
      "exit_code": "0:0",
      "elapsed_s": 162,
      "node": "della-r3c2n12",
      "gpu_model": null,
      "gpu_uuid": null,
      "req_tres": "billing=4,cpu=2,mem=16G,node=1",
      "alloc_tres": "billing=4,cpu=2,mem=16G,node=1",
      "max_rss_kib": null,
      "logs": [
        "/scratch/gpfs/CRYOEM/gilleslab/em_work/codex/k4_symmetry_multiseed_c75cbfffc_20260901/cases/32_ribo_k4_5k_g128_white_noise1_d4_uniform_seed41003/trajectory_analysis/audit_slurm-13303687.out",
        "/scratch/gpfs/CRYOEM/gilleslab/em_work/codex/k4_symmetry_multiseed_c75cbfffc_20260901/cases/32_ribo_k4_5k_g128_white_noise1_d4_uniform_seed41003/trajectory_analysis/audit_slurm-13303687.err"
      ]
    }
  ],
  "shared_artifacts": [
    {
      "role": "safe_to_delete_marker",
      "path": "/scratch/gpfs/CRYOEM/gilleslab/em_work/codex/k4_symmetry_multiseed_c75cbfffc_20260901/SAFE_TO_DELETE",
      "sha256": "e3b0c44298fc1c149afbf4c8996fb92427ae41e4649b934ca495991b7852b855",
      "size_bytes": 0
    },
    {
      "role": "case_table",
      "path": "/scratch/gpfs/CRYOEM/gilleslab/em_work/codex/k4_symmetry_multiseed_c75cbfffc_20260901/case_table.tsv",
      "sha256": "cc7d2f64985c7537b72184d8a2c6a7bca81ffc4edd25c2090500cc8e0abf8a73",
      "size_bytes": 14221
    },
    {
      "role": "submission_environment",
      "path": "/scratch/gpfs/CRYOEM/gilleslab/em_work/codex/k4_symmetry_multiseed_c75cbfffc_20260901/submission.env",
      "sha256": "f71ef2a750887e019dc0f294781dc6b4b6fa3c91fa320253dd4bf43436dfe47a",
      "size_bytes": 2201
    },
    {
      "role": "endpoint_summary_json",
      "path": "/scratch/gpfs/CRYOEM/gilleslab/em_work/codex/k4_symmetry_multiseed_c75cbfffc_20260901/em_kclass_robustness_summary.json",
      "sha256": "ee4205d3136fb746eeb8201319adcc79868e25a5599248c6841cf0c195c2f8d3",
      "size_bytes": 192583
    },
    {
      "role": "endpoint_summary_markdown",
      "path": "/scratch/gpfs/CRYOEM/gilleslab/em_work/codex/k4_symmetry_multiseed_c75cbfffc_20260901/em_kclass_robustness_summary.md",
      "sha256": "5f072f34beb44bb907ce0147d5e79a80d3e5f459e3632aa51986f0f49ad7762a",
      "size_bytes": 60229
    },
    {
      "role": "multiseed_summary_json",
      "path": "/scratch/gpfs/CRYOEM/gilleslab/em_work/codex/k4_symmetry_multiseed_c75cbfffc_20260901/em_kclass_multiseed_summary.json",
      "sha256": "863d0c6b2b8606bce92849bae49c13ef3d29f53aec63563fc3d11e661f8e01e0",
      "size_bytes": 49172
    },
    {
      "role": "multiseed_summary_markdown",
      "path": "/scratch/gpfs/CRYOEM/gilleslab/em_work/codex/k4_symmetry_multiseed_c75cbfffc_20260901/em_kclass_multiseed_summary.md",
      "sha256": "aadd559d66fadcbe25f9e061f33eae20d754df9436743f7c7cdda769ccffeca9",
      "size_bytes": 7755
    },
    {
      "role": "case_slurm_accounting",
      "path": "/scratch/gpfs/CRYOEM/gilleslab/em_work/codex/k4_symmetry_multiseed_c75cbfffc_20260901/slurm_case_accounting.json",
      "sha256": "c04aca221013d18bcf9c291e58161609d747779e0a2e3ccc9fc89671c4199390",
      "size_bytes": 10129
    },
    {
      "role": "setup_launcher",
      "path": "/scratch/gpfs/CRYOEM/gilleslab/em_work/codex/k4_symmetry_multiseed_c75cbfffc_20260901/jobs/em_kclass_matrix_setup.sh",
      "sha256": "c319a9d053e984fa2a3ef5f66d9dc39ba2a6147d7ff5b0e726065b861e669b1e",
      "size_bytes": 8007
    },
    {
      "role": "summary_launcher",
      "path": "/scratch/gpfs/CRYOEM/gilleslab/em_work/codex/k4_symmetry_multiseed_c75cbfffc_20260901/jobs/em_kclass_matrix_summary.sh",